{
  "$schema": "../schemas/asset.schema.json",
  "analysis_profile": "notification-sound-db-bs1770-v1",
  "analyzed_at": "2026-08-09T04:57:55Z",
  "audio": {
    "channel_count": 2,
    "channel_layout": null,
    "duration_seconds": 0.186304,
    "sample_rate_hz": 44100
  },
  "file": {
    "bits_per_sample": 24,
    "byte_size": 50978,
    "codec_long_name": "PCM signed 24-bit big-endian",
    "codec_name": "pcm_s24be",
    "container_format": "aiff",
    "extension": ".aiff",
    "sample_format": "s32"
  },
  "levels": {
    "active_segment": {
      "duration_seconds": 0.18,
      "end_seconds": 0.18,
      "leading_silence_seconds": 0.0,
      "rms_dbfs": -22.754,
      "start_seconds": 0.0,
      "threshold_dbfs": -56.049,
      "trailing_silence_seconds": 0.006304
    },
    "channels": [
      {
        "index": 0,
        "rms_dbfs": -22.903,
        "sample_peak_dbfs": -10.425
      },
      {
        "index": 1,
        "rms_dbfs": -22.903,
        "sample_peak_dbfs": -10.425
      }
    ],
    "rms_dbfs": -22.903,
    "sample_crest_factor_db": 12.478,
    "sample_peak_dbfs": -10.425,
    "true_peak_crest_factor_db": 12.503
  },
  "loudness": {
    "integrated_lufs": -24.6,
    "loudness_range_lu": null,
    "maximum_momentary_lufs": -23.8,
    "maximum_short_term_lufs": null,
    "momentary_window_seconds": 0.4,
    "notes": [
      "silent_tail_added_for_meter_settling",
      "source_shorter_than_momentary_window",
      "source_shorter_than_short_term_window"
    ],
    "short_term_window_seconds": 3.0,
    "standard": "ITU-R BS.1770-5 / EBU Mode",
    "tail_padding_seconds": 3.1,
    "true_peak_dbtp": -10.4
  },
  "schema_version": "1.0.0",
  "sha256": "b2ec85222ea8a32306db02030ee5b3611097d240dc0b9aab5e86a7c202d54177",
  "spectrum": {
    "broad_band_energy_dbfs": {
      "high_5000_10000_hz": -88.488,
      "low_80_200_hz": -66.164,
      "low_mid_200_500_hz": -23.702,
      "mid_500_2000_hz": -29.46,
      "presence_2000_5000_hz": -67.278,
      "sub_20_80_hz": -113.253
    },
    "method": "Welch PSD, Hann window, 4096-sample maximum segment",
    "peak_frequency_hz": 462.964,
    "spectral_centroid_hz": 503.12,
    "speech_band_200_8000_hz_energy_percent": 99.992,
    "third_octave_band_energy_dbfs": [
      {
        "center_hz": 25.0,
        "energy_dbfs": -136.077
      },
      {
        "center_hz": 31.5,
        "energy_dbfs": -134.302
      },
      {
        "center_hz": 40.0,
        "energy_dbfs": -136.148
      },
      {
        "center_hz": 50.0,
        "energy_dbfs": -127.108
      },
      {
        "center_hz": 63.0,
        "energy_dbfs": -118.197
      },
      {
        "center_hz": 80.0,
        "energy_dbfs": -107.081
      },
      {
        "center_hz": 100.0,
        "energy_dbfs": -97.097
      },
      {
        "center_hz": 125.0,
        "energy_dbfs": -80.943
      },
      {
        "center_hz": 160.0,
        "energy_dbfs": -72.711
      },
      {
        "center_hz": 200.0,
        "energy_dbfs": -62.574
      },
      {
        "center_hz": 250.0,
        "energy_dbfs": -45.685
      },
      {
        "center_hz": 315.0,
        "energy_dbfs": -29.366
      },
      {
        "center_hz": 400.0,
        "energy_dbfs": -33.896
      },
      {
        "center_hz": 500.0,
        "energy_dbfs": -26.129
      },
      {
        "center_hz": 630.0,
        "energy_dbfs": -38.909
      },
      {
        "center_hz": 800.0,
        "energy_dbfs": -34.887
      },
      {
        "center_hz": 1000.0,
        "energy_dbfs": -33.041
      },
      {
        "center_hz": 1250.0,
        "energy_dbfs": -46.375
      },
      {
        "center_hz": 1600.0,
        "energy_dbfs": -54.334
      },
      {
        "center_hz": 2000.0,
        "energy_dbfs": -65.442
      },
      {
        "center_hz": 2500.0,
        "energy_dbfs": -69.261
      },
      {
        "center_hz": 3150.0,
        "energy_dbfs": -83.386
      },
      {
        "center_hz": 4000.0,
        "energy_dbfs": -88.816
      },
      {
        "center_hz": 5000.0,
        "energy_dbfs": -87.3
      },
      {
        "center_hz": 6300.0,
        "energy_dbfs": -91.269
      },
      {
        "center_hz": 8000.0,
        "energy_dbfs": -95.893
      },
      {
        "center_hz": 10000.0,
        "energy_dbfs": -104.05
      },
      {
        "center_hz": 12500.0,
        "energy_dbfs": -104.208
      },
      {
        "center_hz": 16000.0,
        "energy_dbfs": -104.919
      }
    ]
  },
  "toolchain": {
    "ffmpeg": "ffmpeg version 8.1.2 Copyright (c) 2000-2026 the FFmpeg developers",
    "ffprobe": "ffprobe version 8.1.2 Copyright (c) 2007-2026 the FFmpeg developers",
    "notification_sound_db": "0.1.0"
  }
}
